{
 "format": "roomio-auditorium",
 "schemaVersion": 2,
 "name": "Example Hall",
 "units": "m",
 "yAxis": "down",
 "stage": {
  "x": 0,
  "y": 1,
  "label": "Stage"
 },
 "foh": {
  "x": 0,
  "y": 20.6
 },
 "areas": [
  {
   "id": "front-left",
   "name": "Front Left",
   "points": [
    [
     -12,
     4
    ],
    [
     -4.5,
     4
    ],
    [
     -4.5,
     11
    ],
    [
     -13.5,
     11
    ]
   ]
  },
  {
   "id": "front-centre",
   "name": "Front Centre",
   "points": [
    [
     -3.5,
     4
    ],
    [
     3.5,
     4
    ],
    [
     3.5,
     11
    ],
    [
     -3.5,
     11
    ]
   ]
  },
  {
   "id": "front-right",
   "name": "Front Right",
   "points": [
    [
     4.5,
     4
    ],
    [
     12,
     4
    ],
    [
     13.5,
     11
    ],
    [
     4.5,
     11
    ]
   ]
  },
  {
   "id": "middle-left",
   "name": "Middle Left",
   "points": [
    [
     -13.5,
     12.5
    ],
    [
     -4.5,
     12.5
    ],
    [
     -4.5,
     19
    ],
    [
     -15,
     19
    ]
   ]
  },
  {
   "id": "middle-centre",
   "name": "Middle Centre",
   "points": [
    [
     -3.5,
     12.5
    ],
    [
     3.5,
     12.5
    ],
    [
     3.5,
     19
    ],
    [
     -3.5,
     19
    ]
   ]
  },
  {
   "id": "middle-right",
   "name": "Middle Right",
   "points": [
    [
     4.5,
     12.5
    ],
    [
     13.5,
     12.5
    ],
    [
     15,
     19
    ],
    [
     4.5,
     19
    ]
   ]
  },
  {
   "id": "rear",
   "name": "Rear",
   "points": [
    [
     -15,
     20.5
    ],
    [
     -2,
     20.5
    ],
    [
     -2,
     21
    ],
    [
     2,
     21
    ],
    [
     2,
     20.5
    ],
    [
     15,
     20.5
    ],
    [
     15,
     26
    ],
    [
     -15,
     26
    ]
   ]
  }
 ]
}
